{
  "schema": "brvario.flight-sites.catalog",
  "schemaVersion": 1,
  "catalogVersion": 2,
  "updatedAt": "2026-06-19",
  "siteCount": 358,
  "sites": [
    {"id":1603,"name":"RAMPA DE PINDOBA","city":"PINDOBA","state":"AL","latitudeE7":-95118700,"longitudeE7":-362408000,"altitudeM":325,"windQuadrants":["E","SE"],"detail":"sites/01603.json","source":"BRVARIO","verticalDropM":185},
    {"id":15822,"name":"SERRA DA CAMONGA","city":"SANTANA DO IPANEMA","state":"AL","latitudeE7":-93527020,"longitudeE7":-372034330,"altitudeM":521,"windQuadrants":["E","N","SE"],"detail":"sites/15822.json","source":"BRVARIO","verticalDropM":183},
    {"id":1610,"name":"RAMPA DE TANQUE D\u2019ARCA","city":"TANQUE D\u2019ARCA","state":"AL","latitudeE7":-95377380,"longitudeE7":-364478370,"altitudeM":591,"windQuadrants":["E","N","NE","NW","S","SE"],"detail":"sites/01610.json","source":"BRVARIO","verticalDropM":375},
    {"id":17904,"name":"RAMPA DA SERRA DO PARA\u00cdSO","city":"\u00c1GUA BRANCA","state":"AL","latitudeE7":-92981840,"longitudeE7":-379154720,"altitudeM":495,"windQuadrants":["E","S","SE"],"detail":"sites/17904.json","source":"BRVARIO","verticalDropM":193},
    {"id":39284,"name":"RAMPA INTERNACIONAL DA CHAPADA DIAMANTI","city":"ABA\u00cdRA","state":"BA","latitudeE7":-132885110,"longitudeE7":-416480250,"altitudeM":1256,"windQuadrants":["E","NE","SE"],"detail":"sites/39284.json","source":"BRVARIO","verticalDropM":450},
    {"id":1796,"name":"RAMPA DE TA\u00cdPE / PITINGA","city":"ARRAIAL D\u2019AJUDA","state":"BA","latitudeE7":-165321830,"longitudeE7":-390823560,"altitudeM":40,"windQuadrants":["E","NE"],"detail":"sites/01796.json","source":"BRVARIO","verticalDropM":40},
    {"id":1891,"name":"RAMPA DO MIRANTE","city":"CANDIBA","state":"BA","latitudeE7":-144568100,"longitudeE7":-429185260,"altitudeM":1210,"windQuadrants":["E","NE","S","SE"],"detail":"sites/01891.json","source":"BRVARIO","verticalDropM":550},
    {"id":1769,"name":"SERRA DA PUTUMA","city":"CONCEI\u00c7\u00c3O DA FEIRA","state":"BA","latitudeE7":-124898680,"longitudeE7":-390133040,"altitudeM":419,"windQuadrants":["E","NE","S","SE"],"detail":"sites/01769.json","source":"BRVARIO","verticalDropM":200},
    {"id":1879,"name":"MORRO S\u00c3O JOS\u00c9","city":"FEIRA DE SANTANA","state":"BA","latitudeE7":-121181690,"longitudeE7":-390526650,"altitudeM":650,"windQuadrants":["E","NE","SE"],"detail":"sites/01879.json","source":"BRVARIO","verticalDropM":450},
    {"id":1825,"name":"RAMPA DE SERRA GRANDE","city":"ILH\u00c9US","state":"BA","latitudeE7":-144746310,"longitudeE7":-390302330,"altitudeM":80,"windQuadrants":["S","SE"],"detail":"sites/01825.json","source":"BRVARIO","verticalDropM":80},
    {"id":1843,"name":"RAMPA DO POMPILHO","city":"ITACAR\u00c9","state":"BA","latitudeE7":-144581190,"longitudeE7":-390279570,"altitudeM":80,"windQuadrants":["NE"],"detail":"sites/01843.json","source":"BRVARIO","verticalDropM":80},
    {"id":47021,"name":"RAMPA DO FELIPE","city":"JACOBINA","state":"BA","latitudeE7":-112718670,"longitudeE7":-404318170,"altitudeM":670,"windQuadrants":["E","NE"],"detail":"sites/47021.json","source":"BRVARIO","verticalDropM":180},
    {"id":1783,"name":"RAMPA GEZER CERQUEIRA","city":"JACOBINA","state":"BA","latitudeE7":-111949050,"longitudeE7":-404702750,"altitudeM":730,"windQuadrants":["E","NE","SE"],"detail":"sites/01783.json","source":"BRVARIO","verticalDropM":240},
    {"id":1860,"name":"RAMPA VICTOR STOCK","city":"JEQUI\u00c9","state":"BA","latitudeE7":-139598330,"longitudeE7":-401846390,"altitudeM":750,"windQuadrants":["E","NE","SE"],"detail":"sites/01860.json","source":"BRVARIO","verticalDropM":450},
    {"id":1777,"name":"RAMPA DE PAI IN\u00c1CIO","city":"LEN\u00c7\u00d3IS","state":"BA","latitudeE7":-124557210,"longitudeE7":-414727060,"altitudeM":370,"windQuadrants":["E","NE"],"detail":"sites/01777.json","source":"BRVARIO","verticalDropM":270},
    {"id":1850,"name":"FAL\u00c9SIAS DE COSTA DOURADA","city":"MUCURI","state":"BA","latitudeE7":-182638060,"longitudeE7":-396451670,"altitudeM":40,"windQuadrants":["E","NE","SE"],"detail":"sites/01850.json","source":"BRVARIO","verticalDropM":40},
    {"id":1805,"name":"RAMPA DA PRAIA DA PAIX\u00c3O","city":"PRADO","state":"BA","latitudeE7":-172657390,"longitudeE7":-392200820,"altitudeM":40,"windQuadrants":["E","NE"],"detail":"sites/01805.json","source":"BRVARIO","verticalDropM":40},
    {"id":38265,"name":"RAMPA CARRO VIRADO","city":"RIBEIRA DO POMBAL","state":"BA","latitudeE7":-109308060,"longitudeE7":-387043890,"altitudeM":456,"windQuadrants":["E","NE"],"detail":"sites/38265.json","source":"BRVARIO","verticalDropM":80},
    {"id":38224,"name":"RAMPA JEQUI\u00c1 DO SERT\u00c3O","city":"RIBEIRA DO POMBAL","state":"BA","latitudeE7":-108444720,"longitudeE7":-387013610,"altitudeM":455,"windQuadrants":["S","SE"],"detail":"sites/38224.json","source":"BRVARIO","verticalDropM":116},
    {"id":1834,"name":"RAMPA DO BOQUEIR\u00c3O","city":"SANTA TERESINHA","state":"BA","latitudeE7":-127108290,"longitudeE7":-395445530,"altitudeM":453,"windQuadrants":["E","NE","SE"],"detail":"sites/01834.json","source":"BRVARIO","verticalDropM":200},
    {"id":1811,"name":"SERRA DA JIB\u00d3IA - PEDRA BRANCA","city":"SANTA TERESINHA","state":"BA","latitudeE7":-128531640,"longitudeE7":-394760230,"altitudeM":786,"windQuadrants":["E","N","NE"],"detail":"sites/01811.json","source":"BRVARIO","verticalDropM":530},
    {"id":1872,"name":"RAMPA DA SERRA DO ABI\u00c1","city":"VALEN\u00c7A","state":"BA","latitudeE7":-133090730,"longitudeE7":-393308740,"altitudeM":551,"windQuadrants":["E","NE","SE"],"detail":"sites/01872.json","source":"BRVARIO","verticalDropM":350},
    {"id":15802,"name":"RAMPA JO\u00c3O GOG\u00d3 - INHOBIM","city":"VIT\u00d3RIA DA CONQUISTA","state":"BA","latitudeE7":-152969560,"longitudeE7":-409179450,"altitudeM":755,"windQuadrants":["E","NE","SE"],"detail":"sites/15802.json","source":"BRVARIO","verticalDropM":320},
    {"id":2273,"name":"RAMPA DE CANOA QUEBRADA","city":"ARACATI","state":"CE","latitudeE7":-45241000,"longitudeE7":-377022560,"altitudeM":30,"windQuadrants":["N","NE"],"detail":"sites/02273.json","source":"BRVARIO","verticalDropM":30},
    {"id":2375,"name":"RAMPA DO MORRO BRANCO","city":"BEBERIBE","state":"CE","latitudeE7":-41707300,"longitudeE7":-380935910,"altitudeM":30,"windQuadrants":["N","NE"],"detail":"sites/02375.json","source":"BRVARIO","verticalDropM":30},
    {"id":2397,"name":"URUBU ECOPARQUE","city":"GUARACIABA DO NORTE","state":"CE","latitudeE7":-41577050,"longitudeE7":-407045490,"altitudeM":998,"windQuadrants":["E","SE"],"detail":"sites/02397.json","source":"BRVARIO","verticalDropM":650},
    {"id":2356,"name":"RAMPA DO MIRANTE","city":"IBIAPINA","state":"CE","latitudeE7":-39027150,"longitudeE7":-408756800,"altitudeM":839,"windQuadrants":["N"],"detail":"sites/02356.json","source":"BRVARIO","verticalDropM":640},
    {"id":2403,"name":"MIRANTE DELTA","city":"IPUEIRAS","state":"CE","latitudeE7":-45895080,"longitudeE7":-408105210,"altitudeM":868,"windQuadrants":["E"],"detail":"sites/02403.json","source":"BRVARIO","verticalDropM":425},
    {"id":2391,"name":"RAMPA DE IP\u00da","city":"IP\u00da","state":"CE","latitudeE7":-42984350,"longitudeE7":-407161530,"altitudeM":460,"windQuadrants":["E","NE","SE"],"detail":"sites/02391.json","source":"BRVARIO","verticalDropM":350},
    {"id":2268,"name":"GUAI\u00daBA","city":"ITACIMA","state":"CE","latitudeE7":-41343690,"longitudeE7":-387674100,"altitudeM":350,"windQuadrants":["E","SE"],"detail":"sites/02268.json","source":"BRVARIO","verticalDropM":210},
    {"id":2253,"name":"RAMPA CRUZEIRO DA M\u00c3E BAIOCA","city":"JARDIM","state":"CE","latitudeE7":-76085210,"longitudeE7":-392764940,"altitudeM":880,"windQuadrants":["E","NE","SE"],"detail":"sites/02253.json","source":"BRVARIO","verticalDropM":220},
    {"id":2409,"name":"RAMPA DO HORTO","city":"JUAZEIRO DO NORTE","state":"CE","latitudeE7":-71716820,"longitudeE7":-393203550,"altitudeM":590,"windQuadrants":["SE"],"detail":"sites/02409.json","source":"BRVARIO","verticalDropM":160},
    {"id":48744,"name":"RAMPA DE VOO LIVRE DE MADALENA","city":"MADALENA","state":"CE","latitudeE7":-48773655,"longitudeE7":-396562778,"altitudeM":468,"windQuadrants":["E"],"detail":"sites/48744.json","source":"BRVARIO","verticalDropM":182},
    {"id":2246,"name":"RAMPA JAMIL SALES","city":"PACATUBA","state":"CE","latitudeE7":-39334480,"longitudeE7":-386130540,"altitudeM":280,"windQuadrants":["E"],"detail":"sites/02246.json","source":"BRVARIO","verticalDropM":130},
    {"id":2380,"name":"RAMPA DE PALM\u00c1CIA","city":"PALM\u00c1CIA","state":"CE","latitudeE7":-41229840,"longitudeE7":-388159100,"altitudeM":210,"windQuadrants":["N","NE"],"detail":"sites/02380.json","source":"BRVARIO","verticalDropM":140},
    {"id":2385,"name":"JUATAMA - RAMPA PEDRA DOS VENTOS","city":"QUIXAD\u00c1","state":"CE","latitudeE7":-50702250,"longitudeE7":-390439460,"altitudeM":520,"windQuadrants":["E","N","NE","NW","S","SE","SW","W"],"detail":"sites/02385.json","source":"BRVARIO","verticalDropM":280},
    {"id":2277,"name":"RAMPA NO MORRO DO URUCUM","city":"QUIXAD\u00c1","state":"CE","latitudeE7":-50360990,"longitudeE7":-390077410,"altitudeM":460,"windQuadrants":["S","SE"],"detail":"sites/02277.json","source":"BRVARIO","verticalDropM":300},
    {"id":2369,"name":"RAMPA DA SANTINHA","city":"REDEN\u00c7\u00c3O","state":"CE","latitudeE7":-42202610,"longitudeE7":-387280570,"altitudeM":190,"windQuadrants":["S","SE"],"detail":"sites/02369.json","source":"BRVARIO","verticalDropM":90},
    {"id":2262,"name":"RAMPA DA SERRA DA MERUOCA","city":"SOBRAL","state":"CE","latitudeE7":-36326220,"longitudeE7":-404068140,"altitudeM":420,"windQuadrants":["S","SW"],"detail":"sites/02262.json","source":"BRVARIO","verticalDropM":350},
    {"id":2362,"name":"SITIO DO BOSCO","city":"TIANGU\u00c1","state":"CE","latitudeE7":-36642830,"longitudeE7":-409600680,"altitudeM":775,"windQuadrants":["E","S","SE"],"detail":"sites/02362.json","source":"BRVARIO","verticalDropM":550},